<?xml version="1.0" encoding="UTF-8"?>
<!DOCTYPE escritores SYSTEM "escritores.dtd">
<escritores>
    <nome id="1">
        <dataNascimento></dataNascimento>
        <dataMorte></dataMorte>
        <nacionalidade></nacionalidade>
        <generoLiterario></generoLiterario>
        <ocupacoes></ocupacoes>
        <premios></premios>
        <conjuge></conjuge>
    </nome>
</escritores>